{"cases":[{"artifact_kind":"filesystem-trace","expected":"created","id":"h0-create-directory-umask","lane":"H0-hermetic","operation":"create_directory"},{"artifact_kind":"filesystem-trace","expected":"created","id":"h0-create-file-umask","lane":"H0-hermetic","operation":"create_file"},{"artifact_kind":"filesystem-trace","expected":"refused","id":"h0-existing-mode-refusal","lane":"H0-hermetic","operation":"existing_unsafe_mode"},{"artifact_kind":"mode-owner-symlink-matrix","expected":"refused","id":"h1-directory-symlink-refusal","lane":"H1-tool-integration","operation":"directory_symlink"},{"artifact_kind":"mode-owner-symlink-matrix","expected":"refused","id":"h1-file-symlink-refusal","lane":"H1-tool-integration","operation":"file_symlink"},{"artifact_kind":"mode-owner-symlink-matrix","expected":"refused","id":"h1-foreign-owner-refusal","lane":"H1-tool-integration","operation":"foreign_owner"}],"gate_id":"C-PRIVATE-FILES","release":"0.3.10","schema_version":"quarry.private-files-case-roster.v1"}
